{
  "$schema": "https://json-schema.org/draft/2020-12/schema",
  "$id": "https://schemas.commandlayer.org/schemas/v1.0.0/trust/endorse/endorse.receipt.schema.json",
  "title": "CLAS Trust Endorse Receipt",
  "description": "A signed receipt proving that an endorsement was issued.",
  "type": "object",
  "additionalProperties": false,
  "required": ["version", "family", "verb", "receipt_id", "request", "endorsement_result", "ts", "proof"],
  "properties": {
    "version": { "const": "1.0.0" },
    "family": { "const": "trust" },
    "verb": { "const": "endorse" },
    "receipt_id": { "type": "string", "minLength": 1 },
    "request": { "$ref": "./endorse.request.schema.json" },
    "endorsement_result": {
      "type": "object",
      "additionalProperties": false,
      "required": ["status"],
      "properties": {
        "status": { "type": "string", "enum": ["endorsed", "refused", "revoked"] },
        "endorsement_id": { "type": "string" },
        "reason": { "type": "string" },
        "expires_at": { "type": "string", "format": "date-time" }
      }
    },
    "ts": { "type": "string", "format": "date-time" },
    "proof": { "$ref": "#/$defs/proof" }
  },
  "$defs": {
    "proof": {
      "type": "object",
      "additionalProperties": false,
      "required": ["canonicalization", "hash", "signature_alg", "signature", "key_id", "signer"],
      "properties": {
        "canonicalization": { "const": "json.sorted_keys.v1" },
        "hash": { "type": "string", "pattern": "^sha256:[a-fA-F0-9]{64}$" },
        "signature_alg": { "const": "ed25519" },
        "signature": { "type": "string", "minLength": 16 },
        "key_id": { "type": "string", "minLength": 1 },
        "signer": { "type": "string", "minLength": 1 }
      }
    }
  }
}
