{
  "version": "1.0.0",
  "family": "trust",
  "verb": "endorse",
  "receipt_id": "rcpt-endorse-20260510-0001",
  "request": {
    "version": "1.0.0",
    "family": "trust",
    "verb": "endorse",
    "endorser": "runtime.commandlayer.eth",
    "subject": {
      "type": "service_identity",
      "id": "svc://payments/settlement-orchestrator",
      "uri": "spiffe://acme.prod/payments/settlement-orchestrator",
      "content_hash": "sha256:aaaaaaaaaaaaaaaaaaaaaaaaaaaaaaaaaaaaaaaaaaaaaaaaaaaaaaaaaaaaaaaa"
    },
    "endorsement": {
      "statement": "Service identity is approved to sign settlement batch receipts.",
      "scope": "capability:settlement-receipt-signing",
      "confidence": 0.55
    },
    "context": {
      "environment": "prod-us-east-1",
      "tenant_id": "tenant-acme-prod",
      "request_id": "req-endorse-20260510-0001",
      "correlation_id": "corr-settlement-20260510-e3"
    }
  },
  "endorsement_result": {
    "status": "endorsed",
    "endorsement_id": "endorse-settlement-signer-20260510-01",
    "reason": "Identity met provenance, uptime, and key-rotation requirements.",
    "expires_at": "2026-11-10T00:00:00Z"
  },
  "ts": "2026-05-10T12:05:00Z",
  "proof": {
    "canonicalization": "json.sorted_keys.v1",
    "hash": "sha256:aaaaaaaaaaaaaaaaaaaaaaaaaaaaaaaaaaaaaaaaaaaaaaaaaaaaaaaaaaaaaaaa",
    "signature_alg": "ed25519",
    "signature": "ed25519:demo:9f7c4d1ab3e6c8d14f2a98b7c3d5e1f09a8b7c6d5e4f3029182736455aabbccd",
    "key_id": "cl-key-1",
    "signer": "runtime.commandlayer.eth"
  }
}
